doc_id,text,genre
9101_toboilfreshmeat.txt,"To Boil Fresh Meat.

In boiling fresh meat, care is necessary to have the water boiling all
the time it is in the pot; if the pot is not well scummed, the
appearance of the meat will be spoiled.

Mutton and beef are preferred, by some, a little rare; but pork and veal
should always be well done. A round of beef that is stuffed, will take
more than three hours to boil, and if not stuffed, two hours or more,
according to the size; slow boiling is the best. A leg of mutton
requires from two to three hours boiling, according to the size; a
fore-quarter from an hour to an hour and a half; a quarter of lamb,
unless, very large, will boil in an hour. Veal and pork will take rather
longer to boil than mutton.

All boiled fresh meat should have drawn butter poured over it, after it
is dished, and be garnished with parsley.

The liquor that fresh meat, or poultry, is boiled in, should be saved,
as an addition of vegetables, herbs, and dumplings make a nourishing
soup of it.

A large turkey will take three hours to boil--a small one half that
time; secure the legs to keep them from bursting out; turkeys should be
blanched in warm milk and water; stuff them and rub their breasts with
butter, flour a cloth and pin them in. A large chicken that is stuffed
should boil an hour, and small ones half that time. The water should
always boil before you put in your meat or poultry. When meat is
frozen, soak it in cold water for several hours, and allow more time in
the cooking.",recipe
9101_toboilgreencorn.txt,"To Boil Green Corn.

Pick out ears near the same size, and have the water boiling when you
put them in; half an hour is long enough for young corn; that which is
old and hard will take an hour or more; if young corn is boiled too
long, it becomes hard and indigestible.",recipe
9101_toboilgreensandpoke.txt,"To Boil Greens and Poke.

After skimming the pot that the bacon has been boiled in, put in cabbage
sprouts, and let them boil till the stalks are tender; all greens are
best boiled in a net. Spinach cooks in a few minutes; some persons
prefer it when boiled in salt and water; you should have drawn butter or
hard eggs to eat with it when done in this way. There are several kinds
of wild greens to be found in the country in the spring, as wild
mustard, poke and lambs-quarter, which are very good cooked as cabbage
sprouts. Pour boiling water on poke, after tying it in bunches, as
asparagus, let it stand a few minutes; pour off the water; boil it with
a little salt in the water, and if you choose a little salaeratus; dress
it with butter, and dish it as asparagus.",recipe
9101_toboilpotatoes.txt,"To Boil Potatoes.

When the potatoes are old, pare them, put them in plenty of boiling
water, and boil them till you can run a fork through easily; if you wish
to have them whole, pour off all the water, throw in some salt, and let
them stand a few minutes over coals, to let the steam go off; they will
then be white and mealy.

It is a mistaken notion, to boil potatoes in but little water, as they
are sure to turn dark and taste strong. In cold weather they may be
kept pared several days in a pan of water, by changing the water every
day, and will be whiter. If you like mashed potatoes, take them up
when barely done, sprinkle them with salt and mash them; put in a
spoonful of cream and a small lump of butter; keep them hot till they
are taken to table.

In the summer when potatoes are young, put them in a small tub, with a
little water, and rub them with a piece of brick, to break the skin; you
can then peel enough for dinner with a knife in a few minutes. When they
are older, boil them with the skins on, and squeeze them separately in a
cloth, to make them mealy. New potatoes are nice with cream and butter
over them.

In boiling old potatoes, some persons cut them round without paring,
which allows the moisture to escape; this is an improvement: you can
then either peel them or send them to table without peeling.",recipe
9101_toboilrice.txt,"To Boil Rice.

Pick a pint of rice, wash it clean--put it in three pints of boiling
water: it should boil fast, and by the time the water evaporates, the
rice will be sufficiently cooked; set it where it will keep hot, until
you are ready to dish it.",recipe
9101_toboilsaltcod.txt,"To Boil Salt Cod.

Put your fish to soak over night; change the water in the morning, and
let it stay till you put it on, which should be two hours before dinner;
keep it at scalding heat all the time, but do not let it boil, or it
will get hard; eat it with egg sauce or drawn butter. If you have any
cod fish left from dinner, mix it with mashed potatoes, and enough flour
to stick them together; season with pepper; make it into little cakes,
and fry them in ham drippings.",recipe
9101_toboilsaltsalmon.txt,"To Boil Salt Salmon.

Let salmon soak over night, and boil it slowly for two hours; eat it
with drawn butter. To pickle salmon after it has been boiled, heat
vinegar scalding hot, with whole peppers and cloves; cut the fish in
small square pieces; put it in a jar, and pour the vinegar over. Shad
may be done in the same way.",recipe
9101_toboilsaltshadmackerelorherring.txt,"To Boil Salt Shad, Mackerel Or Herring.

Wash the fish from the pickle; put it in a frying-pan; cover it with
water, and let it boil fifteen minutes; take it up and drain it between
two plates; put a little butter over and send it hot to the table: or,
after boiling, you can flour, and fry it in drippings of any kind.",recipe
9101_toboilveal.txt,"To Boil Veal.

Have a piece of the fore quarter nicely washed and rubbed with Hour;
let it boil fast; a piece of five pounds will boil in an hour and a
half; dish it up with drawn butter. Oyster sauce is an improvement to
boiled veal.",recipe
9101_tobroilchickens.txt,"To Broil Chickens.

Split the chickens down the back; season them, and put them on the
gridiron over clear coals; cover them over with a plate, (which will
make them cook faster,) baste with melted butter: be careful not to let
them burn. Make gravy of the giblets, boiled in water and chopped fine;
put in butter, thicken and season it; pour this in a dish, and put the
chickens on the top.",recipe
9101_tobroilshad.txt,"To Broil Shad.

Soak a salt shad a day or night previous to cooking, it is best to drain
an hour before you put it to the fire; if it hangs long exposed to the
air, it loses its flavor: grease the gridiron to keep it from sticking;
have good coals, and put the inside down first. Fresh shad is better to
be sprinkled with salt, an hour before it is put to broil; put a plate
over the top to keep the heat in. In broiling shad or other fresh fish
you should dust them with corn meal before you put them down.",recipe
9101_tobroiltomatoesforbreakfast.txt,"To Broil Tomatoes for Breakfast.

Take large round tomatoes, wash and wipe them, and put them on the
gridiron over lively coals--the stem side down; when this is brown, turn
them and let them cook till quite hot through; place them on a hot dish
and send them quickly to table, where each one may season for himself
with pepper, salt and butter.",recipe
9101_tobrownacalfsheadwithskinon.txt,"To Brown A Calf's Head With The Skin On.

After scalding and washing the head clean, take out the eyes, cut off
the ears, and let it boil half an hour, when cold, cleave the upper from
the lower jaw, take out the tongue, strike off the nose, score the part
which has the skin on, rub it over with beaten egg, sprinkle it over
with salt, parsley, cayenne and black pepper, lay pieces of butter over
it, and put it in a dutch-oven to brown, basting it often, cut down the
lower part in slices, skin the tongue and palate, and cut them up, put
them in a pot with a little water, when done, thicken it with brown
flour and butter, season it with pepper, salt, some pickled oysters,
wine or brandy (if you like it,) and let it stew fifteen minutes. Lay
the baked head in a dish and put the hash around it, and lay force meat
balls or brain cakes round the edge of the dish.",recipe
9101_tobrownflourgravy.txt,"To Brown Flour for Gravy, &c.

Put some flour in a dutch-oven and set it over some hot coals; keep
stirring it until it is of a light-brown color; in this way several
pounds can be done at once, and kept in a jar covered; and is very
convenient to thicken brown soups and gravies with.",recipe
9101_tobrownoystersintheirownjuice.txt,"To Brown Oysters in their own Juice.

Take a quart of large oysters, wash them in their own juice, drain and
dip them in the yelk of eggs; heat butter in a frying-pan, and after
seasoning them with pepper and salt, put them in separately; when they
are brown on both sides, draw them to one side of the pan; strain the
liquor, and put it in with a piece of butter and flour enough to
thicken it.",recipe
9101_todrypumpkins.txt,"To Dry Pumpkins.

Pare them, and cut them in thin slices; have a strong thread, and
string them on it with a needle; hang them out in the sun till dry,
taking them in at night; tie them up in a muslin bag, and hang them in
a dry place. Soak them before they are stewed, and they are nearly as
good for puddings as when in season. Some dry them, as apples, by
spreading on boards.",recipe
9101_tofricasseecorn.txt,"To Fricassee Corn.

Cut green corn off the cob; put it in a pot, and just cover it with
water; let it boil half an hour; mix a spoonful of flour with half a
pint of rich milk, pepper, salt, parsley, thyme and a piece of butter;
let it boil a few minutes, and take it up in a deep dish. Corn will do
to cook in this way when too old to boil on the cob.",recipe
9101_tofrybeefwithkidney.txt,"To Fry Beef with Kidney.

Cut the kidney in small pieces; take out all the strings and let it
soak several hours in salt and water; wash and drain it; season some
pieces of beef and kidney, and put them in a frying pan, with hot lard
or drippings of any kind; dust a little flour over; when it is fried
on both sides, take it up in a dish; mix a spoonful of flour in some
water with salt and pepper, and pour in; when it has boiled, pour it
over the beef.",recipe
9101_tofrychickens.txt,"To Fry Chickens.

After cutting up the chickens, wash and drain them; season them with
salt and pepper; rub each piece in flour, and drop them separately in a
frying-pan or dutch-oven of hot lard; when brown, turn the other side to
fry; make a thickening of rich milk, flour, a piece of butter, salt, and
chopped parsley; take up the chicken on a dish; pour a little water in
the pan to keep the gravy from being too thick; put in the thickening,
stir it, and let it boil a few minutes; then pour it over the chicken.",recipe
9101_tofryclams.txt,"To Fry Clams.

After opening them as oysters, wash them in their own liquor and drain
then; make a batter of an egg, flour and pepper; dip them in this, and
fry them in butter.",recipe
9101_tofryeggplant.txt,"To Fry Egg Plant.

Cut them in slices half an inch thick; sprinkle them with salt, and let
them stand a few minutes to extract the bitter taste; wash them in cold
water, and wipe them dry; season with salt and pepper; dip them in
flour, and fry them in butter.

Another way of cooking them is to cut them in thin slices, and bake them
on a bake-iron that is hot enough to bake cakes.",recipe
9101_tofryfreshfish.txt,"To Fry Fresh Fish.

Have the fish well scalded, washed and drained; cut slits in the sides
of each; season them with salt and pepper, and roll them in corn flour;
have in your frying-pan hot lard or bacon drippings; if the fish have
been kept several days, dip them in egg before rolling them in corn
flour, to keep them from breaking; fry them light brown on both sides.",recipe
9101_tofryham.txt,"To Fry Ham.

Slice the ham and if it is very salt, pour boiling water on it, and let
it soak a while; then fry it with a small piece of lard; when done, dish
it; mix together flour, milk, parsley and pepper, let it boil, and pour
it over the ham.",recipe
9101_tofryhominy.txt,"To Fry Hominy.

Put a little lard in your frying-pan, and make it hot; mash and salt the
hominy; put it in, and cover it over with a plate; let it cook slowly
for half an hour, or longer if you like it very brown; when done, turn
it out in a plate. If you do not like it fried, mash it well, with a
little water, salt, and butter, and warm it in a frying-pan.",recipe
9101_tofryliver.txt,"To Fry Liver.

Liver should be cut across the grain in slices about half an inch thick;
pour boiling water over it, drain and season it with pepper and salt;
flour each piece and drop it in a frying-pan of hot bacon drippings; do
not fry it any longer than it is done, or it will he hard; take it up in
a dish, make gravy as for beef, and pour over it.",recipe
9101_tofryoysters.txt,"To Fry Oysters.

Pick out the largest oysters and drain them; sprinkle them with pepper
and salt; beat up an egg, and dip them first in it, and then in pounded
crackers, and fry them in butter. It is a plainer way to dip them in
corn meal.",recipe
9101_tofrypotatoes.txt,"To Fry Potatoes.

Cold potatoes are very good fried for breakfast with scraps of bacon; if
they have been mashed, make them out in cakes with a little flour, and
fry them brown, or slice them.",recipe
9101_tofrytomatoes.txt,"To Fry Tomatoes.

Slice them, season with pepper and salt, and fry in hot butter; if they
are green, dip them in flour after being seasoned.",recipe
9101_tofryveallambpork.txt,"To Fry Veal, Lamb or Pork.

Cut up the meat in thin slices, and season it; dip it in flour and drop
it in a pan of hot lard; when brown, take it up, and make gravy with
flour, milk, parsley, pepper and salt, which stir in.",recipe
9101_tofryvealsliver.txt,"To Fry Veal's Liver.

Cut the liver and heart across the grain, wash it well, pour boiling
water on, and let it stand a few minutes, then drain and season it with
salt and pepper, flour it and drop it in hot lard; when it is brown on
both sides, dish it, dust a little flour in the pan, and pour in some
water, let it boil a minute, stirring in a seasoning of parsley, thyme,
or sweet marjoram; pour the gravy over the liver. This is a good
breakfast dish.",recipe
9101_tofryvealsweetbreads.txt,"To Fry Veal Sweet Breads.

Dip them in the yelk of an egg beaten, then in a mixture of grated
bread, or flour and salt and pepper, fry them a nice brown.",recipe
9101_tokeepcornforwinter.txt,"To Keep Corn for Winter.

When boiled, cut the corn off the cob, and spread it on dishes; set
these in the oven to dry after the bread comes out. If you have no oven,
it can be dried in a stove of moderate heat, or round a fire. When
perfectly dry, tie it up in muslin bags, and hang them in a dry place;
when you use it, boil it till soft in water; mix flour, milk, butter,
pepper and salt together, and stir in.",recipe
9101_tokeepgreenbeansforwinter.txt,"To Keep Green Beans for Winter.

Boil salt and water to make a strong pickle; string the beans, and put
them in a tight wooden firkin; sprinkle them with salt as they go in;
when the pickle is cold, pour it on, and put on a weight to keep the
beans under; they will keep in the cellar till the next spring. They
should soak several hours in cold water before they are boiled.",recipe
9101_tokeepvegetablesinwinter.txt,"To Keep Vegetables in Winter.

Beets, parsnips, carrots and salsify should he dug up before the frost
is severe; those wanted for use in the winter should be put in barrels,
and covered with sand; what you do not want till spring should be buried
in the garden, with sods on the top. Celery may be dug in November, and
set in a large box covered with sand, in the cellar, with the roots
down; it will keep till the frost is out of the ground. Or it may be
left in the ground all winter, and dug as you want it for use.",recipe
9101_tomatoes.txt,"Tomatoes.

If you wish to bake tomatoes in the oven with bread, pour boiling water
on, and skin them; cut them in small pieces; season with salt and
pepper, and put them in a pan with crumbs of bread and butter; cover the
pan with a plate, and bake three-quarters of an hour; when done, mash
them and take them out on a dish.",recipe
9101_tomatoesslicedwithonions.txt,"Tomatoes sliced with Onions.

Pick the best tomatoes; let them stand a little while in cold water,
then peel and slice them. To about six tomatoes, you may add two red
onions, also sliced; season with pepper, plenty of salt, and a small
portion of vinegar.",recipe
9101_tomatojellytowatwithroastmeat.txt,"Tomato Jelly, to eat with Roast Meat.

Wash the tomatoes, and put them in a bell-metal kettle, with a little
water; let them boil thirty minutes; take them out and strain them
through a sieve, till you get all the pulp; let it settle and pour off
the top; put the thick part in deep plates, and set them in the oven
after the bread is drawn; season it with pepper and salt to your taste,
and put it away in a jar. It can either be eaten cold, or warmed up with
crumbs of bread and butter. Some persons slice tomatoes, and dry them on
dishes in an oven.",recipe
9101_tomatoomelet.txt,"Tomato Omelet.

Pour boiling water on the tomatoes, skin and cut them fine; to one quart
of this, put two chopped onions and a lump of butter the size of an egg;
let them boil half an hour, then mash them; put in grated bread, pepper,
salt, and the yelks of two eggs.",recipe
9101_topickle100oysters.txt,"To Pickle 100 Oysters.

Drain off the liquor from the oysters, wash them and put to them a
table-spoonful of salt, and a tea-cup of vinegar; let them simmer over
the fire about ten minutes, taking off the scum as it rises; then take
out the oysters, and put to their own liquor a table-spoonful of whole
black pepper, and a tea-spoonful of mace and cloves; let it boil five
minutes, skim, and pour it over the oysters in a jar.",recipe
9101_topotfreshherring.txt,"To Pot Fresh Herring.

Scale and wash them well; cut off the heads and fins, and season them
with salt, pepper and cloves; pack them neatly in a large jar, and pour
on enough cold vinegar to cover them; put a plate over the top of the
jar, and set it in a moderately warm oven, or on the top of a stove, in
a pan of hot water, for five or six hours; they will keep in a cool
place several weeks, and are an excellent relish. The jar or pan should
be of stone ware, or fire-proof yellow ware.",recipe
9101_toputtomatoesforwinter.txt,"To put up Tomatoes for Winter.

Gather a quantity of tomatoes, wash, scald, skin and cut them up; season
them highly with pepper and salt, and put them in a large stone jar; set
this in the oven with your bread, and leave it till it is cold; stir
them, and set them in the oven every time you bake for several weeks;
when the juice is nearly dried up, put a piece of white paper over the
jar, melt some lard and pour on it. When you use them, stew them with
bread, butter and water.",recipe
9101_toroastagoose.txt,"To Roast a Goose.

Make a stuffing of bread, butter, salt, pepper, sage, thyme and
onions; it requires but little butter, as geese are generally fat;
wash it well in salt and water, wipe it, and rub the inside with salt
and pepper. A common sized goose will roast in an hour, and a small
one in less time; pour off nearly all the fat that drips from the
goose, as it will make the gravy too rich. Make hash gravy of the
giblets the same as for turkey.",recipe
9101_toroastapig.txt,"To Roast a Pig--Hash Gravy, &c.

Have a pig of a suitable size, clean it well, and rub the inside with
pepper and salt. Make a stuffing of bread, butter, parsley, sage and
thyme; if the bread is stale, pour a little boiling water on it; mix
altogether; fill the pig, and sew it up with strong thread; put in the
skewers and spit, and tie the feet with twine; have a pint and a half of
water in the bottom of the tin kitchen, with a spoonful of lard and a
little salt, with this baste it and turn it, so as each part will have
the benefit of the fire. It should be basted until the skin begins to
get stiff with the heat of the fire; then grease it all over with butter
or lard, and continue to turn it before the fire, but baste no more, or
the skin will blister. A pig will take from two to three hours to roast,
according to the size; when it is done, pour the water out in a skillet;
season it and thicken it with flour and water. To make hash gravy, put
the liver and heart to boil in three pints of water; after they have
boiled an hour, chop them very fine, put them back in the pot and stir
in a thickening of flour and water, with salt, pepper, parsley and
thyme. Have the gravies in separate tureens on either side of the pig.
Apple sauce and cold slaw are almost indispensable with pig.",recipe
9101_toroastaturkey.txt,"To Roast a Turkey--to make Gravy, &c.

A very large turkey will take three hours to roast, and is best done
before the fire in a tin oven. Wash the turkey very clean, and let it
lay in salt and water twenty minutes, but not longer, or it changes the
color; rub the inside with salt and pepper; have ready a stuffing of
bread and butter, seasoned with salt, pepper, parsley, thyme, an onion,
if agreeable, and an egg; if the bread is dry, moisten it with boiling
water; mix all well together, and fill the turkey; if you have fresh
sausage, put some in the craw; have a pint of water in the bottom of the
dripping pan or oven, with some salt and a spoonful of lard, or butter;
rub salt, pepper and butter over the breast; baste it often, and turn it
so that each part will be next the fire.

Gravy may be made from the drippings in the oven by boiling it in a
skillet, with thickening and seasoning. Hash gravy should be made by
boiling the giblets and neck in a quart of water, which chop fine,
then season and thicken; have both the gravies on the table in
separate tureens.

Cranberry and damson sauce are suitable to eat with roast poultry.",recipe
9101_toroastbeef.txt,"To Roast Beef.

Season the beef with pepper and salt, and put it in the tin kitchen,
well skewered to the spit, with a pint of water in the bottom: baste and
turn it frequently, so that every part may have the fire. A very large
piece of beef will take three hours to roast; when it is done, pour the
gravy out into a skillet, let it boil, and thicken it with flour mixed
with water; if it be too fat, skim off the top, which will be useful for
other purposes.",recipe
9101_toroastpork.txt,"To Roast Pork.

After washing the pork, cut the skin in squares or stripes; season it
with salt and pepper, and baste it with salt and water; thicken, and
boil up the gravy.",recipe
9101_toroastvealandlamb.txt,"To Roast Veal and Lamb.

Veal should be well seasoned, and rubbed with lard; when it begins to
brown, baste it with salt and water; a large loin will take from two to
three hours to roast, the thin part of the fore-quarter an hour; it
should be well done; boil up and thicken the gravy. A leg of veal or
mutton may be stuffed before baking. Lamb and mutton do not require to
be rubbed with lard, as they are generally fatter than veal; make the
gravy as for veal. A quarter of lamb will roast in an hour; a loin of
mutton in two hours.",recipe
9101_tostewarockfish.txt,"To Stew a Rock Fish.

Rub the fish with salt and pepper, and a little cayenne on the inside;
put it in an oval stew-pan. To a fish that weighs six pounds, put a pint
of water; when it is about half done; season it well with salt and
pepper, and a little mace or cloves; rub a quarter of a pound of butter
in a half a tea-cup of flour, with a little parsley and thyme; stir this
in with a pint of oysters. Serve it with the gravy in the dish. A large
fish should be allowed an hour, small ones half an hour.",recipe
9101_tostewclams.txt,"To Stew Clams.

Strain the liquor and stew them in it for about twenty minutes; make a
thickening of flour, water and pepper; stir this in and let it boil
up; have some bread toasted and buttered in a deep dish, and pour the
clams over.

Clam soup may be made by putting an equal quantity of water with the
liquor, and putting in toasted bread, crackers or dumplings.",recipe
9101_tosteworfrymushrooms.txt,"To Stew or Fry Mushrooms.

Be careful in gathering mushrooms that you have the right kind; they are
pink underneath, and white on the top, and the skin will peel off
easily, but it sticks to the poisonous ones.

After you have peeled them, sprinkle them with salt and pepper, and put
them in a stew pan, with a little water, and a lump of butter; let them
boil fast ten minutes, and stir in a thickening of flour and cream. They
may be fried in butter, or broiled on a gridiron. They are sometimes
very abundant in the fall, on ground that has not been ploughed for
several years; they appear after a warm rain; they may be peeled,
salted, and allowed to stand some hours before cooking.",recipe
9101_tostewoysters.txt,"To Stew Oysters.

Open them and throw them in a stew-pan, with a lump of butter; make a
thickening of flour and water, salt and pepper, and stir it in just as
the oysters boil; when they are done, take them up in a deep covered
dish, with buttered toast in the bottom.",recipe
9101_tostewpotatoes.txt,"To Stew Potatoes.

Chop or slice cold potatoes; season with pepper and salt; stew them,
with a little butter and milk, and a dust of flour; when nearly done,
stir in a yelk of egg with some chopped parsley--they will cook in a few
minutes, and may be sliced over night if you wish an early breakfast.",recipe
9101_tostewsweetbreads.txt,"To Stew Sweet Breads.

Stew them in a little water, with butter, flour, and a little cream;
season with salt, pepper, parsley and thyme.",recipe
