doc_id,text,genre
9624_quincecordial.txt,"QUINCE CORDIAL.

Take the finest and ripest quinces you can procure, wipe them clean,
and cut out all the defective parts. Then grate them into a tureen or
some other large vessel, leaving out the seeds and cores. Let the
grated pulp remain covered in the tureen for twenty-four hours. Then,
squeeze it through a jelly-bag or cloth. To six quarts of the juice
allow a quart of cold water, three pounds of loaf-sugar, (broken up,)
and a quart of white brandy. Mix the whole well together, and put it
into a stone jar. Have ready three very small flannel or thick muslin
bags, (not larger than two inches square,) fill one with grated nutmeg,
another with powdered mace, and the third with powdered cloves; and pat
them, into the jar that the spice may flavour the liquor without mixing
with it. Leave the jar uncorked for a few days; reserving some of the
liquor to replace that which may flow over in the fermentation.
Whenever it has done working, bottle it off, but do not use it for six
months. If not sufficiently bright and clear, filter it through fine
muslin, pinned round the bottom of a sieve, or through a white blotting
paper fastened in the same manner.",recipe
9624_quincejelly.txt,"QUINCE JELLY.

Take fine ripe yellow quinces, wash them and remove all the blemishes,
cut them in pieces, but do not pare or core them. Put them into a
preserving-pan with clear spring water. If you, are obliged to use
river water, filter it first; allowing one pint to twelve large
quinces. Boil them gently till they are all soft and broken. Then put
them into a jelly-bag, and do not squeeze it till after the clear
liquid has ceased running. Of this you must make the _best_ jelly,
allowing to each pint a pound of loaf-sugar. Having dissolved the sugar
in the liquid, boil them together about twenty minutes, or till you
have a thick jelly.

In the meantime, squeeze out all that is left in the bag. It will not
be clear, but you can make of it a very good jelly for common purposes.",recipe
9624_quincemarmalade.txt,"QUINCE MARMALADE.

Take six pounds of ripe yellow quinces; and having washed them clean,
pare and core them, and cut them into small pieces. To each pound of
the cut quinces allow half a pound of powdered loaf-sugar. Put the
parings and cores into a kettle with water enough to cover them, and
boil them slowly till they are all to pieces, and quite soft. Then
having put the quinces with the sugar into a porcelain preserving
kettle, strain over them, through a cloth, the liquid from the parings
and cores. Add a little cochineal powdered, and sifted through thin
muslin. Boil the whole over a quick fire till it becomes a thick smooth
mass, keeping it covered except when you are skimming it; and always
after skimming, stir it up well from the bottom.

When cold, put it up in glass jars. If you wish to use it soon, put it
warm into moulds, and when if is cold, set the moulds in lukewarm
water, and the marmalade will turn out easily.",recipe
9624_quincepudding.txt,"QUINCE PUDDING.

Take six large ripe quinces; pare them, and cut out all the blemishes.
Then scrape them to a pulp, and mix the pulp with half a pint of cream,
and half a pound of powdered sugar, stirring them together very hard.
Beat the yolks of seven eggs, (omitting all the whites except two,) and
stir them gradually into the mixture, adding two wine glasses of rose
water. Stir the whole well together and bake it in a buttered dish
three quarters of an hour Grate sugar over it when cold.

If you cannot obtain cream, you may substitute a quarter of a pound of
fresh butter stirred with the sugar and quince. A baked apple pudding
may be made in the same manner.",recipe
9624_quinssauce.txt,"
QUIN’S SAUCE.

Pound in a mortar six large anchovies, moistening them with their own
pickle. Then chop and pound six small onions. Mix them with a little
black pepper and a little cayenne, half a glass of soy, four glasses of
mushroom catchup, two glasses of claret, and two of black walnut
pickle. Put the mixture into a small sauce-pan or earthen pipkin, and
let it simmer slowly till all the bones of the anchovies are dissolved.
Strain it, and when cold, bottle it for use; dipping the cork in melted
rosin, and tying leather over it. Fill the bottles quite full.",recipe
9624_radishes.txt,"RADISHES.

To prepare radishes for eating, wash them and lay them in clean cold
water as soon as they are brought in. Shortly before they go to table,
scrape off the thin outside skin, trim the sharp end, cut off the
leaves at the top, leaving the stalks about an inch long, and put them
on a small dish. Eat them with salt.

Radishes should not be eaten the day after they are pulled, as they are
extremely unwholesome if not quite fresh.

The thick white radishes, after being scraped and trimmed, should be
split or cleft in four, half way down from the top.",recipe
9624_radishpods.txt,"RADISH PODS.

Gather sprigs or bunches of radish pods while they are young and
tender, but let the pods remain on the sprigs; it not being the custom
to pick them off. Put them into strong salt and water, and let them
stand two days. Then drain and wipe them and put them into a clean
stone jar. Boil an equal quantity of vinegar and water. Pour it over
the radish pods while hot, and cover them closely to keep in the steam.
Repeat this frequently through the day till they are very green. Then
pour off the vinegar and water, and boil for five minutes some very
strong vinegar, with a little bit of alum, and pour it over them. Put
them into a stone jar, (and having added some whole mace, whole pepper,
a little tumeric and a little sweet oil,) cork it closely, and tie over
it a leather or oil-cloth.",recipe
9624_raspberryicecream.txt,"RASPBERRY ICE CREAM.

Is made according to the preceding receipt.",recipe
9624_raspberryjam.txt,"RASPBERRY JAM.

Take fine raspberries that are perfectly ripe. Weigh them, and to each
pound of fruit allow three quarters of a pound of fine loaf-sugar. Mash
the raspberries, and break up the sugar. Then mix them together, and
put them into a preserving kettle over a good fire. Stir them
frequently and skim them. The jam will be done in half an hour. Put it
warm into glasses, and lay on the top a white paper cut exactly to fit
the inside, and dipped in brandy. Then tie on another cover of very
thick white paper.

Make blackberry jam in the same manner.",recipe
9624_raspberryvinegar.txt,"RASPBERRY VINEGAR.

Put two quarts of ripe fresh-gathered raspberries into a stone or china
vessel, and pour on them a quart of vinegar. Let it stand twenty-four
hours, and then strain it through a sieve. Pour the liquid over two
quarts of fresh raspberries, and let it again infuse for a day and a
night. Then strain it a second time. Allow a pound of loaf sugar to
every pint of juice. Break up the sugar, and let it melt in the liquor.
Then put the whole into a stone jar, cover it closely, and set it in a
kettle of boiling water, which must be kept on a quick boil for an
hour. Take off all the scum and when cold, bottle the vinegar for use.

Raspberry vinegar mixed with water is a pleasant and cooling beverage
in warm weather; also in fevers.",recipe
9624_raspberrywine.txt,"RASPBERRY WINE.

Put four gallons of ripe raspberries into a stone jar, and mash them
with a round stick. Take four gallons of soft water, (measured after it
has boiled an hour,) and strain it warm over the raspberries. Stir it
well and let it stand twelve hours. Then strain it through a bag, and
to every gallon of liquor put three pounds of loaf-sugar. Set it over a
clear fire, and boil and skim it till the scum ceases to rise. When it
is cold bottle it. Open the bottles every day for a fortnight, closing
them again in a few minutes. Then seal the corks, and lay the bottles
on their sides in saw-dust, which must not be from pine wood.",recipe
9624_ratafia.txt,"RATAFIA.

Pound in a mortar, and. mix together a pound of shelled bitter almonds,
an ounce of nutmegs, a pound of fine loaf-sugar, and one grain
(apothecaries’ weight) of ambergris. Infuse these ingredients for a
week in a gallon of white brandy or proof spirit. Then filter it, and
bottle it for use.",recipe
9624_rawegg_illness.txt,"RAW EGG.

Break a fresh egg into a saucer, and mix a little sugar with it; also,
if approved, a small quantity of wine. Beat the whole to a strong
froth. It is considered a restorative.",recipe
9624_redcurrantjelly.txt,"RED CURRANT JELLY.

The currants should be perfectly ripe and gathered on a dry day. Strip
them from the stalks, and put them into a stone jar. Cover the jar, and
set it up to the neck in a kettle of boiling water. Keep the water
boiling round the jar till the currants are all broken, stirring them
up occasionally. Then put them into a jelly-bag, and squeeze out all
the juice. To each pint of juice allow a pound and a quarter of the
best loaf-sugar. Put the sugar into a porcelain kettle, pour the juice
over it, and stir it frequently till it is all melted. Then set the
kettle over a moderate fire, and let it boil twenty minutes, or till
you find that the jelly congeals in the spoon when, you hold it in the
air; skim it carefully all the time. When the jelly is done, pour it
warm into tumblers, and cover each with two rounds of white tissue
paper, cut to fit exactly the inside of the glass.

Jelly of gooseberries, plums, raspberries, strawberries, barberries,
blackberries, grapes, and other small fruit may all be made in this
manner.",recipe
9624_regentspunch.txt,"REGENT’S PUNCH.

Take four large lemons; roll them on the table to make them more juicy,
and then pare them as thin as possible. Cut out all the pulp, and throw
away the seeds and the white part of the rind. Put the yellow rind and
the pulp into a pint of boiling water with two tea-spoonfuls of raw
green tea of the best sort. Let all boil together about ten minutes.
Then strain it through linen, and stir in a pound of powdered
loaf-sugar and a bottle of champagne, or of any liquor suitable for
punch. Set it again over the fire, and when just ready to boil, remove
it, and pour it into a china bowl or pitcher, to be sent round in
glasses.",recipe
9624_remedyforaburn_medicine.txt,"REMEDY FOR A BURN.

After immediately applying sweet oil, scrape the inside of a raw
potato, and lay some of it on the place, securing it with a rag. In a
short time put on fresh potato, and repeat this application very
frequently. It will give immediate ease, and draw out the fire. Of
course, if the burn is bad, it is best to send for a physician.",recipe
9624_rennetwhey_illness.txt,"RENNET WHEY.

Wash a small bit of rennet about two inches square, in cold water, to
get off the salt. Put it into a tea-cup and pour on it sufficient
lukewarm water to cover it. Let it stand all night, and in the morning
stir the rennet water into a quart pitcher of warm milk. Cover it, and
set it near the fire till a firm curd is formed. Pour off the whey from
it, and it will be found an excellent and cooling drink. The curd may
be eaten (though not by a sick person) with wine, sugar, and nutmeg.",recipe
9624_rhubarbjam.txt,"RHUBARB JAM.

Peel the rhubarb stalks and cut them into small square pieces. Then
weigh them, and to each pound allow three quarters of a pound of
powdered loaf-sugar. Put the sugar and the rhubarb into a large, deep,
white pan, in alternate layers, the top layer to be of sugar—cover it,
and let it stand all night. In the morning, put it into a preserving
kettle, and boil it slowly till the whole is dissolved into a thick
mass, stirring it frequently, and skimming it before every stirring.
Put it warm into glass jars, and tie it up with brandy paper.",recipe
9624_rhubarbtarts.txt,"RHUBARB TARTS.

Take the young green stalks of the rhubarb plant, or spring fruit as it
is called in England; and having peeled off the thin skin, cut the
stalks into small pieces about an inch long, and put them into a
sauce-pan with plenty of brown sugar, and its own juice. Cover it, and
let it stew slowly till it is soft enough to mash to a marmalade. Then
set it away to cool. Have ready some fresh baked shells; fill them with
the stewed rhubarb, and grate white sugar over the top.

For covered pies, cut the rhubarb very small; mix a great deal of sugar
with it, and put it in raw. Bake the pies about three quarters of an
hour.",recipe
9624_ricecakes.txt,"RICE CAKES.

Pick and wash half a pint of rice, and boil it very soft. Then drain
it, and let it get cold. Sift a pint and a half of flour over the pan
of rice, and mix in a quarter of a pound of butter that has been warmed
by the fire, and a salt-spoonful of salt. Beat five eggs very light,
and stir them gradually into a quart of milk. Beat the whole very hard,
and bake it in muffin rings, or in waffle-irons. Send them to table
hot, and eat them with butter, honey, or molasses. You may make these
cakes of rice flour instead of mixing together whole rice and wheat
flour.",recipe
9624_ricecustard.txt,"RICE CUSTARD.

Boil some rice in milk till it is quite dry; then put it into small
tea-cups, (pressing it down hard,) and when it is cold and has taken
the shape of the cups, turn it out into a deep dish, and pour a boiled
custard round it. Lay on the top of each lump of rice a piece of
preserved quince or peach, or a piece of fruit jelly. In boiling the
rice, you may mix with, it raisins or currants; if so, omit the
sweetmeats on the top.

Another way of boiling custard is to put the mixture into a pitches,
set it in a vessel of boiling water, place it on hot coals or in a
stove, and let it boil slowly, stirring it all the time.",recipe
9624_ricedumplings.txt,"RICE DUMPLINGS.

Pick and wash a pound of rice, and boil it gently in two quarts of
water till it becomes dry; keeping the pot well covered, and not
stirring it. Then take it off the fire, and spread it out to cool on
the bottom, of an inverted sieve; loosening the grains lightly with a
fork, that all the moisture may evaporate. Pare a dozen pippins or
other, large juicy apples, and scoop out the core. Then fill up the
cavity with marmalade, or with lemon and sugar. Cover every apple all
over with a thick coating of the boiled rice. Tie up each in a
separate, cloth, [Footnote: Your pudding and dumpling cloths should be
squares of coarse thick linen, hemmed, and with tape strings sewed to
them. After using, they should be washed, dried, and ironed; and kept
in one of the kitchen drawers, that they may be always ready when
wanted.] and put them into a pot of cold water. They will require about
an hour and a quarter after they begin to boil; perhaps longer.

Turn them out on a large dish, and be careful in doing so not to break
the dumplings. Eat them with cream sauce, or with wine sauce, or with
butter, sugar, and nutmeg beaten together.",recipe
9624_riceflummery.txt,"RICE FLUMMERY.

To two quarts of milk allow half a pound of ground rice. Take out one
pint of the milk, and mix the rice gradually with it into a batter;
making it quite smooth and free from lumps. Put the three pints of milk
into a skillet, (with a bunch of peach leaves or a few peach-kernels.)
and let it come to a boil. Then while it is still boiling, stir in by
degrees the rice batter, taking care not to have it lumpy; add sugar,
mace, and rose brandy to your taste; or you may flavour it with a small
tea-spoonful of oil of lemon. When it has boiled sufficiently, and is
quite thick, strain it, and put it into a mould to congeal. Make a rich
boiled custard, (flavoured in the same manner,) and send it to table in
a pitcher to eat with the flummery. Both should be cold. If you mould
it in tea-cups, turn it out on a deep dish, and pour the custard round
it.",recipe
9624_ricejelly_illness.txt,"RICE JELLY.

Having picked and washed a quarter of a pound of rice, mix it with half
a pound of loaf-sugar, and just sufficient water to cover it. Boil it
till it becomes a glutinous mass; then strain it; season it with
whatever may be thought proper; and let it stand to cool.",recipe
9624_ricemilk.txt,"RICE MILK.

Pick and wash half a pint of rice, and boil it in a quart of water till
it is quite soft. Then drain it, and mix it with a quart of rich milk.
You may add half a pound of whole raisins. Set it over hot coals, and
stir it frequently till it boils. When it boils hard, stir in
alternately two beaten eggs, and four large table-spoonfuls of brown
sugar. Let it continue boiling five minutes longer; then take it off,
and send it to table hot. If you put in raisins you must let it boil
till they are quite soft.",recipe
9624_richbrownsoup.txt,"RICH BROWN SOUP.

Take six pounds of the lean of fresh beef, cut from the bone. Stick it
over with four dozen cloves. Season it with a tea-spoonful of salt, a
tea-spoonful of pepper, a tea-spoonful of mace, and a beaten nutmeg.
Slice half a dozen onions; fry them in butter; chop them, and spread
them over the meat after you have put it into the soup-pot. Pour in
five quarts of water, and stew it slowly for five or six hours;
skimming it well. When the meat has dissolved into shreds, strain it,
and return the liquid to the pot. Then add a tumbler and a half, or six
wine glasses of claret or port wine. Simmer it again slowly till dinner
time. When the soup is reduced to three quarts, it is done enough. Put
it into a tureen, and send it to table.",recipe
9624_richmaccaronisoup.txt,"RICH MACCARONI SOUP.

Take a quart of clear gravy soup, and boil in it a pound of the best
maccaroni cut into pieces. When it is tender, take out half of the
maccaroni, and add to the remainder two quarts more of the soup. Boil
it till the maccaroni is entirely dissolved and incorporated with the
liquid. Strain it; then return it to the soup-pan, and add to it the
remainder of the maccaroni, (that was taken out before the pieces
broke,) and put in a quarter of a pound of grated Parmesan cheese. Let
it simmer awhile, but take it up before it comes to a boil.

It may be made with milk instead of gravy soup.",recipe
9624_richvealsoup.txt,"RICH VEAL SOUP.

Take three pounds of the scrag of a neck of veal, cut it into pieces,
and put it with the bones (which must be broken up) into a pot with two
quarts of water. Stew it till the meat is done to rags, and skim it
well. Then strain it and return it to the pot.

Blanch and pound in a mortar to a smooth paste, a quarter of a pound of
sweet almonds, and mix them with the yolks of six hard boiled eggs
grated, mid a pint of cream, which must first have been boiled or it
will curdle in the soup. Season it with nutmeg and mace. Stir the
mixture into the soup, and let it boil afterward about three minutes,
stirring all the time. Lay in the bottom of the tureen some slices of
bread without the crust. Pour the soup upon it, and send it to table.",recipe
9624_richwhitesoup.txt,"RICH WHITE SOUP.

Take a pair of large fat fowls. Cut them up. Butter the inside of the
soup-pot, and put in the pieces of fowl with two pounds of the lean of
veal, cut into pieces, or with four calf’s feet cut in half. Season
them with a tea-spoonful of salt, a half tea-spoonful of cayenne
pepper, and a dozen blades of mace. Cover them with water, and stew it
slowly for an hour, skimming it well. Then take out the breasts and
wings of the fowls, and having cut off the flesh, chop it fine. Keep
the pot covered, and the veal and the remainder of the fowls still
stewing.

Mix the chopped chicken with the grated crumb of about one quarter of a
loaf of stale bread, (a six cent loaf,) having soaked the crumbs in a
little warm milk. Have ready the yolks of four hard boiled eggs, a
dozen sweet almonds, and half a dozen bitter ones blanched and broken
small. Mix the egg and almonds with the chopped chicken and grated
bread, and pound all in a mortar till it is well incorporated. Strain
the soup from the meat and fowl, and stir this mixture into the liquid,
after it has stewed till reduced to two quarts. Having boiled
separately a quart of cream or rich milk, add it hot to the soup, a
little at a time. Cover it, and let it simmer a few minutes longer.
Then send it to table.

These two soups (the brown and the white) are suited to dinner parties.",recipe
9624_ringworms_medicine.txt,"RING-WORMS.

Rub mercurial ointment on the ring-worm previous to going to bed, and
do not wash it off till morning. It will effect a cure if persevered
in; sometimes in less than a week.",recipe
9624_roastedpotatoes.txt,"ROASTED POTATOES.

Take large fine potatoes; wash and dry them, and either lay them on the
hearth and keep them buried in hot wood ashes, or bake them slowly in a
Dutch oven. They will not be done in less than two hours. It will save
time to half-boil them before they are roasted. Send them to table with
the skins on, and eat them with cold butter and salt. They are
introduced with cold meat at supper.

Potatoes keep best buried in sand or earth. They should never be wetted
till they are washed for cooking. If you have them in the cellar, see
that they are well covered with matting or old carpet, as the frost
injures them greatly.",recipe
9624_rockcake.txt,"ROCK CAKE.

Blanch three-quarters of a pound of shelled sweet almonds, and bruise
them fine in a mortar, but not to a smooth paste as for maccaroons.
Add, as you pound them, a little rose-water. Beat to a stiff froth the
whites of four eggs, and then beat in gradually a pound of powdered
loaf-sugar. Add a few drops of oil of lemon. Then mix in the pounded
almonds. Flour your hands, and make the mixture into little cones or
pointed cakes. Spread sheets of damp, thin, white paper on buttered
sheets of tin, and put the rock cakes on it, rather far apart. Sprinkle
each with powdered loaf-sugar. Bake them of a pale brown, in a brisk
oven. They will be done in a few minutes.

When cold, take them off the papers.",recipe
9624_romanpunch.txt,"ROMAN PUNCH.

Grate the yellow rinds of twelve lemons and two oranges upon two pounds
of loaf-sugar. Squeeze on the juice of the lemons and oranges; cover
it, and let it stand till next day. Then strain it through a sieve, add
a bottle of champagne, and the whites of eight eggs beaten to a froth.
You may freeze it or not.",recipe
9624_rosebrandy.txt,"ROSE BRANDY.

Nearly fill a china or glass jar with freshly-gathered rose leaves, and
pour in sufficient French white brandy to fill it quite up; and then
cover it closely. Next day put the whole into a strainer, and having
squeezed and pressed the rose leaves and drained off the liquid, throw
away the leaves, put fresh ones into the jar, and return the brandy to
it. Repeat this every day while roses are in season, (taking care to
keep the jar well covered,) and you will find the liquid much better
than rose water for flavouring cakes and puddings.",recipe
9624_rosecordial.txt,"ROSE CORDIAL.

Put a pound of fresh rose leaves into a tureen, with a quart of
lukewarm water. Cover the vessel, and let them infuse for twenty-four
hours. Then squeeze them through a linen bag till all the liquid is
pressed out. Put a fresh pound of rose leaves into the tureen, pour the
liquid back into it, and let it infuse again for two days. You may
repeat this till you obtain a very strong infusion. Then to a pint of
the infusion add half a pound of loaf-sugar, half a pint of white
brandy, an ounce of broken cinnamon, and an ounce of coriander seeds.
Put it into a glass jar, cover it well, and let it stand for two weeks.
Then filter it through a fine muslin or a blotting paper (which must be
white) pinned on the bottom of a sieve; and bottle it for use",recipe
9624_rusks.txt,"RUSKS.

Sift three pounds of flour into a large pan, and rub into it half a
pound of butter, and half a pound of sugar. Beat two eggs very light,
and stir them into a pint and a half of milk, adding two
table-spoonfuls of rose water, and three table-spoonfuls of the best
and strongest yeast. Make a hole in the middle of the flour, pour in
the liquid, and gradually mix the flour into it till you have a thick
batter. Cover it, and set it by the fire to rise. When it is quite
light, put it on your paste-board and knead it well. Then divide it
into small round cakes and knead each separately. Lay them very near
each other in shallow iron pans that have been sprinkled with flour.
Prick the top of each rusk with a fork, and set them by the fire to
rise again for half an hour or more. When they are perfectly light,
bake them in a moderate oven. They are best when fresh.

You can convert them into what are called Hard Rusks, or Tops and
Bottoms, by splitting them in half, and putting them again into the
oven to harden and crisp.",recipe
9624_russianorswedishturnips.txt,"RUSSIAN OR SWEDISH TURNIPS

This turnip (the Ruta Baga) is very large and of a reddish yellow
colour; they are generally much liked. Take off a thick paring, cut the
turnips into large pieces, or thick slices, and lay them awhile in cold
water. Then boil them gently about two hours, or till they are quite
soft. When done, drain, squeeze and mash them, and season them with
pepper and salt, and a very little butter. Take care not to set them in
a part of the table where the sun comes, as it will spoil the taste.

Russian turnips should always be mashed.",recipe
