doc_id,text,genre
29982_anewmayonnaise.txt,"A NEW MAYONNAISE (Soyer's).--Put a quarter of a pint of stiff veal jelly
(that has been nicely flavored with vegetables) on ice in a bowl,
whisking it till it is a white froth; then add half a pint of salad oil
and six spoonfuls of tarragon vinegar, _by degrees_, first oil, then
vinegar, continually whisking till it forms a white, smooth, sauce-like
cream; season with half a teaspoonful of salt, a quarter ditto of white
pepper, and a very little sugar, whisk it a little more and it is ready.
It should be dressed pyramidically over the article it is served with.
The advantage of this sauce is that (although more delicate than any
other) you may dress it to any height you like, and it will remain so
any length of time; if the temperature is cool, it will remain hours
without appearing greasy or melting. It is absolutely necessary,
however, that it should be prepared on ice.",recipe
29982_anicelittlebreakfastdish.txt,"A NICE LITTLE BREAKFAST DISH IS made thus: Cut two long slices of cold
meat and three of bread, buttered thickly, about the same shape and
size; season the meat with pepper, salt, and a little finely chopped
parsley; or, if it is veal, a little chopped ham; then lay one slice of
bread between two of meat, and have the other two slices outside; fasten
together with short wooden skewers. If you have a quick oven, put it in;
and take care to baste with butter thoroughly, that the bread may be all
over crisp and brown. If you can't depend on your oven, fry it in very
hot fat as you would crullers; garnish with sprigs of parsley, and serve
very hot.",recipe
29982_anothervealandhampie.txt,"ANOTHER VEAL AND HAM PIE, more usual, and probably the ""weal and hammer""
that ""mellered the organ"" of Silas Wegg, was manufactured by Mrs. Boffin
from this recipe; it is as follows:

Take the thick part of breast of veal, removing all the bones, which put
on for gravy, stewing them long and slowly; put a layer of veal, pepper
and salt, then a thin sprinkling of ham; if boiled, cut in slices; if
raw, cut a slice in dice, which scald before using, then more veal and
again ham. If force-meat balls are liked, make some force-meat as for
Windsor pie, using if you prefer it chopped hard-boiled eggs in place of
chopped meat, and binding into a paste with a raw egg; then make into
balls, which drop into the crevices of the pie; boil two or three eggs
quite hard, cut each in four and lay them round the sides and over the
top, pour in about a gill of gravy, and cover the same as the Windsor
pie. In either of these pies the force-meat may be left out, a
sweetbread cut up, or mushrooms put in.

A chicken pie to eat cold is very fine made in this way.",recipe
29982_baba.txt,"BABA.--One pound of flour; take one quarter of it, and make a sponge
with half an ounce of compressed yeast and a little warm water, set it
to rise, make a hole in the rest of the flour, add to it ten ounces of
butter, three eggs, and a dessert-spoonful of sugar, a little salt,
unless your butter salts it enough, which is generally the case. Beat
all together well, then add five more eggs, one at a time, that is to
say, add one egg and beat well, then another and beat again, and so on
until the five are used. When the paste leaves the bowl it is beaten
enough, but not before; then add the sponge to it, and a large half
ounce of citron chopped, the same of currants, and an ounce and a half
of sultana raisins, seedless. Let it rise to twice its size, then bake
it in an oven of dark yellow paper heat; the small round babas are an
innovation of the pastry-cook to enable him to sell them uncut. But the
baba proper should be baked in a large, deep, upright tin, such as a
large charlotte russe mold, when they keep for several days fresh, and
if they get stale, make delicious fritters, soaked in sherry and dipped
in frying batter.

In some cases, however, it may be preferred to make them as usually seen
at French pastry cooks; for this purpose you require a dozen small-sized
_round_ charlotte russe molds, which fill half full only, as they rise
very much; bake these in a hotter oven, light brown paper heat; try with
a twig as you would any other cake, if it comes out dry it is done; then
prepare a syrup as follows: Boil half pound of sugar in a pint of water,
add to this the third of a pint of rum, and some apricot pulp--peach
will of course do--and boil all together a few minutes; pour this half
an inch deep in a dish, and stand the cake or cakes in it; it should
drink up all the syrup, you may also sprinkle some over it. If any syrup
remains, use it to warm over your cake when stale, instead of the
sherry.",recipe
29982_beefaugratin.txt,"BEEF AU GRATIN.--Cut a little fat bacon or pork very thin, sprinkle on
it chopped parsley, onion, and mushrooms (mushroom powder will do) and
bread-crumbs; then put in layers of beef, cut thick, and well and
closely hacked, then another layer of bacon or pork cut thin as a wafer,
and of seasoning, crumbs last; pour over enough broth or gravy to
moisten well, in which a little brandy or wine may be added if an
especially good dish is desired; bake slowly an hour.",recipe
29982_beefolives.txt,"
BEEF OLIVES are no novelty to the ear, but it is a novel thing to find
them satisfactory to the palate.

Take some stale bread-crumbs, an equal quantity of beef finely chopped,
some parsley, and thyme; a little scraped ham if you have it, a few
chives, or a slice of onion, all chopped small as possible; put some
butter in a pan, and let this force-meat just simmer, _not fry_, in it
for ten minutes. While this is cooking, cut some underdone oblong slices
of beef about half an inch thick, hack it with a sharp knife on _both
sides_; then mix the cooked force-meat with the yolk of an egg and a
tablespoonful of gravy; put a spoonful of this paste in the center of
each slice of meat and tie it up carefully in the shape of an egg. Then
if you have some nice gravy, thicken it with a piece of butter rolled in
flour, roll each olive slightly in flour and lay it in the gravy and let
it very gently _simmer_ for half an hour. A few chopped oysters added to
the gravy will be a great addition. Or you may lay each olive on a thin
slice of fat pork, roll it up, tie it, dip it in flour, and bake in a
quick oven until beautifully brown.",recipe
29982_biscuitglacealacharlesdickens.txt,"BISCUIT GLACÉ À LA CHARLES DICKENS.--One pint of syrup (32°), fifteen
yolks of eggs, three gills of peach pulp, colored pink with cochineal,
one gill of noyeau, half a pint of thick cream, and a little chocolate
water-ice, made with half a pint of syrup and four ounces of the best
chocolate smoothly mixed and frozen ready.

Mix syrup, yolks, peach pulps, noyeau, and a few drops of vanilla, whip
high; mix with the whipped cream, and set in ice for one hour and a half
in brick-shaped molds, then turn out (if very firm), and cut in slices
an inch thick, and coat them all over, or on top and sides, with the
chocolate ice, smoothing with a knife dipped in cold water; serve in
paper cases.",recipe
29982_biscuitglacealathackeray.txt,"BISCUIT GLACÉ À LA THACKERAY.--One pint of syrup (32°), one pint of
strawberry pulp, fifteen yolks of eggs, one ounce of vanilla sugar
(flavor a little sugar with vanilla), half a pint of thick cream.

Mix syrup, yolks, strawberry, and vanilla sugar, whipping as before,
then add the whipped cream lightly; fill paper cases, either round or
square; surround each with a band of stiff paper, to reach half an inch
above the edge of the case, the bands to be pinned together to secure
them; place them in a freezer. When about to send to table, remove the
bands of paper, and cover with macaroons bruised fine and browned in the
oven. The bands of paper are meant to give the biscuit the appearance of
having risen while supposed to bake.",recipe
29982_boeufalajardiniere.txt,"B[OE]UF À LA JARDINIÈRE.--Put in a fireproof dish if you have it, or a
thick saucepan, a pint of beef broth, a small bunch each of parsley,
chervil, tarragon--very little of this--shallot or onion, capers,
pickled gherkins, of each or any a teaspoonful chopped fine; roll a
large tablespoonful of butter with a dessert-spoonful of brown flour,
stir it in; then take slices of underdone beef, with a blunt knife hack
each slice all over in fine dice, but not to separate or cut up the
slices; then pepper and salt each one and lay it in with the herbs,
sprinkle a layer of herbs over the beef and cover closely; then stand
the dish in the oven to slowly cook for an hour, or, if you use a
stew-pan, set in a pan of boiling water on the stove for an hour where
the water will just boil. Serve on a dish surrounded with young carrots
and turnips if in season, or old ones cut.",recipe
29982_boucheesdesdames.txt,"BOUCHÉES DES DAMES, a very ornamental and delicious little French cake,
is sufficiently novel to deserve a place here, I think. Make any nice
drop cake batter (either sponge, or sponge with a little butter in it I
prefer); drop one on buttered paper and bake; if it runs, beat in a
_little_ more flour and sugar, but not much, or your cakes will be
brittle; they should be the size, when done, of a fifty-cent piece, and
I find half a teaspoonful of batter dropped generally makes them about
right. Have a tin cutter or tin box lid, if you have no cutter so small,
about the size, and with it trim each cake when baked; then take half
the number and spread some with a very thin layer of red currant jelly,
others with peach or raspberry; then on each so spread put a cake that
is unspread, thus making a tiny sandwich or jelly cake. If you have
different sorts of jelly, put each separate, as you must adapt the
flavor of your icing to the jelly. For red currant, ice with chocolate
icing. Recipes for icing are so general that I refer you to your cookery
book. Those with peach may have white icing, flavored with almond, or
with rum, beating in a little more sugar if the flavoring dilutes your
icing too much. Almond flavoring goes well with raspberry. Cakes with
raspberry jelly or jam should be iced pink, coloring the icing with
prepared cochineal or cranberry juice. Thus you have your cakes brown,
pink, and white, which look very pretty mixed.

The process of icing is difficult to do after they are put together, but
they are much handsomer this way, and keep longer. You require, to
accomplish it, a good quantity of each kind of icing, and a number of
little wooden skewers; stick one into each cake and dip it in the icing,
let it run off, then stand the other end of the skewer in a box of sand
or granulated sugar. The easiest way is to ice each half cake before
putting in the jelly; when the icing is hard spread with jelly, and put
together.",recipe
29982_brioche.txt,"BRIOCHE.--I suppose the very name of this delectable French dainty will
call up in the mind's eye of many who read this book that great ""little""
shop, _Au Grand Brioche_, on the Boulevarde Poissonière, where, on
Sunday afternoons, scores of boys from the Lycées form _en queue_ with
the general public, waiting the hour when the piles of golden brioche
shall be ready to exchange for their eager sous. But I venture to say, a
really fine brioche is rarely eaten on this side the Atlantic. They
being a luxury welcome to all, and especially aromatic of Paris, I tried
many times to make them, obtaining for that purpose recipes from French
friends, and from standard French books, but never succeeded in
producing the ideal brioche until I met with Gouffé's great book, the
""_Livre de Cuisine_,"" after reading which, I may here say, all secrets
of the French kitchen are laid bare; no effort is spared to make
everything plain, from the humble _pot-au-feu_ to the most gorgeous
monumental _plât_. And I would refer any one who wants to become
proficient in any French dish, to that book, feeling sure that, in
following strictly the directions, there will be no failure. It is the
one book I have met with on the subject in which no margin is left for
your own knowledge, if you have it, to fill up. But to the brioche.",recipe
29982_celerycream.txt,"CELERY CREAM is a most delicious and little-known white soup, and all
lovers of good things will thank me for introducing it.

Have some nice veal stock, or the water in which chickens have been
boiled, reduced till it is rich enough, will do, or some very rich
mutton broth, but either of the former are preferable; then put on a
half cup of rice in a pint of rich milk, and grate into it the white
part and root of two heads of celery. Let the rice milk cook very
slowly at the back of the stove, adding more milk before it gets at all
stiff; when tender enough to mash through a coarse sieve or fine
colander add it to the stock, which must have been strained and be quite
free from sediment, season with salt and a little _white_ pepper or
cayenne, boil all together gently a few minutes. It should look like
rich cream, and be strongly flavored with celery. Of course the quantity
of rice, milk, and celery must depend on the quantity of stock you have.
I have given the proportion for one quart, which, with the milk, etc.,
added, would make about three pints of soup.",recipe
29982_creamwalnuts.txt,"CREAM WALNUTS.--Make ready some almonds, some walnuts in halves, some
hazelnuts, or anything of the sort you fancy; let them be very dry. Take
_fondant_ made from a pound of sugar, set it in a bowl in a saucepan of
boiling water, stirring it till it is like cream. Then having flavored
it with vanilla or lemon, drop in your nuts one by one, taking them out
with the other hand on the end of a fork, resting it on the edge of your
bowl to drain for a second, then drop the nut on to a waxed or buttered
paper neatly. If the nut shows through the cream it is too hot; take it
out of the boiling water and beat till it is just thick enough to mask
the nut entirely, then return it to the boiling water, as it cools very
rapidly and becomes unmanageable, when it has to be warmed over again.",recipe
29982_cromesquisoflamb.txt,"CROMESQUIS OF LAMB is a Polish recipe. Cut some underdone lamb--mutton
will of course do--quite small; also some mushrooms, cut small, or the
powder. Put in a saucepan a piece of glaze the size of a pigeon's egg,
with a _little_ water or broth, warm it and thicken with yolks of two
eggs, just as you would make boiled custard, that is, without letting
it come to the boil, or it will curdle; then add the mushrooms and meat,
let all get cold, and divide it into small pieces, roll in bread-crumbs
sifted, then in egg, then in crumbs again, and fry in very hot fat; or
you may, _after_ rolling in bread-crumbs, lay each piece in a spoon and
dip it into frying batter; let the extra batter run off, and drop the
cromesquis into the hot fat. These will be good made of beef and rolled
up in a bard of fat pork cut thin, and fried; serve with sauce piquant
made thus: Take some chopped parsley, onion, and pickled cucumbers,
simmer till tender, and thicken with an equal quantity of butter and
flour. Of course your own brightness will tell you that, if you are in
haste, a spoonful of Montpellier butter, the same of flour, melted in a
little water, to which you add a teaspoonful of vinegar, will make an
excellent sauce piquant, and this same is excellent for anything fried,
as breaded chops, croquettes, etc. I may here say, that where two or
three herbs are mentioned as necessary, for instance, parsley, tarragon,
and chervil, if you have no tarragon you must leave it out, or chervil
the same. It is only a matter of flavoring, at the same time _flavor_ is
a great deal, and these French herbs give that indescribable _cachet_ to
a dish which is one of the secrets of French cooking. Therefore if you
are a wise matron you will have a supply on hand, even if only bought
dry from the druggist.",recipe
29982_curacoa.txt,"CURAÇOA may be successfully imitated by pouring over eight ounces of the
_thinly_ pared rind of very ripe oranges a pint of boiling water, cover,
and let it cool; then add two quarts of brandy, or strong French spirit,
cover closely, and let it stand fourteen days, shaking it every day.
Make a clarified syrup of two pounds of sugar into one pint of water,
well boiled; strain the brandy into it, leaving it covered close
another day. Rub up in a mortar one drachm of potash, with a teaspoonful
of the liqueurs; when well blended, put this into the liqueur, and in
the same way pound and add a drachm of alum, shake well, and in an hour
or two filter through thin muslin. Ready for use in a week or two.",recipe
29982_cutletsalajardiniere.txt,"CUTLETS À LA JARDINIÈRE.--Trim some thick cutlets from a cold leg of
mutton, or chops from the loin, dip them in frying batter, _à la
Carême_, fry crisp and quickly, and serve wreathed round green peas, or
a ragout made as follows: Take young carrots, turnips, green peas, white
beans; stew gently in a little water to which the bones of the meat and
trimmings have been added (and which must be carefully removed not to
disfigure the vegetables). Encircle this ragout with the fried cutlets,
and crown with a cauliflower.",recipe
29982_deviledmeat.txt,"DEVILED MEAT.--Our better halves are usually fond of this, especially
for breakfast or lunch.

For this dish take a pair of turkey or chicken drumsticks or some nice
thick wedges of underdone beef or mutton, score them deeply with a
knife and rub them over with a sauce made thus: A teaspoonful of
vinegar, the same of Harvey or Worcestershire sauce, the same of
mustard, a _little_ cayenne, and a tablespoonful of salad oil, or butter
melted; mix all till like cream, and take care your meat is thoroughly
moistened all over with the mixture, then rub your gridiron with butter.
See that the fire is clear, and while the gridiron is getting hot, chop
a teaspoonful of parsley very fine, mix it up with a piece of butter the
size of a walnut, and lay this in a dish which you will put to get hot.
Then put the meat to be grilled on the fire and turn often, so that it
will not burn; when hot through and brown, lay it in the hot dish, lay
another hot dish over it, and serve as quickly as possible with hot
plates.

Or the grill may be served with what Soyer calls his _Mephistophelian
sauce_, which he especially designed for serving with deviled meats.
Chop six shallots or small onions, wash and press them in the corner of
a clean cloth, put them in a stew-pan with half a wineglass of chili
vinegar (pepper sauce), a chopped clove, a tiny bit of garlic, two bay
leaves, an ounce of glaze; boil all together ten minutes; then add four
tablespoonfuls of tomato sauce, a _little_ sugar, and ten of broth
thickened with roux (or water will do if you have no broth).

It will be remarked that in many French recipes a _little_ sugar is
ordered. This is not meant to sweeten, or even be perceptible; but it
enriches, softens, tones, as it were, the other ingredients as salt
does.",recipe
29982_fondantpanache.txt,"FONDANT PANACHÉ.--Take your _fondant_, divide it in three equal parts,
color one pink and flavor as you choose, leave the other white and
flavor also as you please; but it must agree with the pink, and both
must agree with the next, which is chocolate. Melt a little unsweetened
chocolate by setting it in a saucer over the boiling kettle, then take
enough of it to make your third piece of _fondant_ a fine brown; now
divide the white into two parts; make each an inch and a half wide, and
as long as it will; do the same with the chocolate _fondant_; then take
the pink, make it the same width and length, but of course, not being
divided, it will be twice as thick; now butter slightly the back of a
plate, or, better still, get a few sheets of waxed paper from the
confectioner's; lay one strip of the chocolate on it, then a strip of
white on that, then the pink, the other white, and lastly the chocolate
again; then lightly press them to make them adhere, but not to squeeze
them out of shape. You have now an oblong brick of parti-colored candy;
leave it for a few hours to harden, then trim it neatly with a knife and
cut it crosswise into slices half an inch think, lay on waxed paper to
dry, turning once in a while, and pack away in boxes.

If your _fondant_ gets very hard while you work, stand it over hot water
a few minutes.",recipe
29982_frangipanetartlets.txt,"FRANGIPANÉ TARTLETS.--One quarter pint of cream, four yolks of eggs, two
ounces of flour, three macaroons, four tablespoonfuls of powdered sugar,
the peel of a grated lemon, and a little citron cut very fine, a little
brandy and orange-flower water. Put all the ingredients, except the
eggs, in a saucepan--of course you will mix the flour smooth in the
cream first--let them come to a boil slowly, stirring to prevent lumps;
when the flour smells cooked, take it off the fire for a minute, then
stir the beaten yolks of eggs into it. Stand the saucepan in another of
boiling water and return to the stove, stirring till the eggs seem
done--about five minutes, if the water boils all the time. Line patty
pans with puff paste, and fill with frangipané and bake. Ornament with
chopped almonds and meringue, or not, as you please.

It is very difficult to make fine puff paste in warm weather, and almost
impossible without ice; for this reason I think the brioche paste
preferable; but if it is necessary to have it for any purpose, you must
take the following precautions:

Have your water iced; have your butter as firm as possible by being
kept on ice till the last moment; make the paste in the coolest place
you have, and under the breeze of an open window, if possible; make it
the day before you use it, and put it on the ice between every ""turn,""
as each rolling out is technically called; then leave it on the ice, as
you use it, taking pieces from it as you need them, so that the warmth
cannot soften the whole at once, when it would become quite
unmanageable. The condition of the oven is a very important matter, and
I cannot do better than transcribe the rules given by Gouffé, by which
you may test its fitness for any purpose:

Put half a sheet of writing paper in the oven; if it catches fire it is
too hot; open the dampers and wait ten minutes, when put in another
piece of paper; if it blackens it is still too hot. Ten minutes later
put in a third piece; if it _gets dark brown_ the oven is right for all
small pastry. Called ""_dark brown paper heat_."" _Light brown paper heat_
is suitable for _vol-au-vents_ or fruit pies. _Dark yellow paper heat_
for large pieces of pastry or meat pies, pound cake, bread, etc. _Light
yellow paper heat_ for sponge cake, meringues, etc.

To obtain these various degrees of heat, you try paper every ten minutes
till the heat required for your purpose is attained. But remember that
""light yellow"" means the paper only tinged; ""dark yellow,"" the paper the
color of ordinary pine wood; ""light brown"" is only a shade darker, about
the color of nice pie-crust, and dark brown a shade darker, by no means
coffee color.",recipe
29982_gouffespotaufeu.txt,"GOUFFÉ'S POT-AU-FEU.--Four pounds of lean beef, six quarts of water, six
ounces of carrot, six of turnip, six of onion, half an ounce of celery,
one clove, salt.

Put the meat on in cold water, and just before it comes to the boil skim
it, and throw in a wineglass of cold water, skim again, and, when it is
""on the boil,"" again throw in another wineglass of cold water; do this
two or three times. The object of adding the cold water is to keep it
just off the boil until all the scum has risen, as the boiling point is
when it comes to the surface, yet once having boiled, the scum is broken
up, and the soup is never so clear.

The meat must simmer slowly, _not boil_, for three hours before the
vegetables are added, then for a couple of hours more.

It is necessary to be very exact in the proportions of vegetables; but,
of course, after having weighed them for soups once or twice, you will
get to know about the size of a carrot, turnip, etc., that will weigh
six ounces. The exact weight is given until the eye is accustomed to it.

This soup strained, and boiled down to one half, becomes _consommé_.",recipe
29982_icedsoufflealabyron.txt,"ICED SOUFFLÉ À LA BYRON.--One pint of sugar syrup of 32 degrees (get
this at a druggist's if you do not understand sugar boiling), three
gills of strained raspberry juice, one lemon, one gill of maraschino,
fifteen yolks of eggs, two ounces of chocolate drops, half a pint of
very thick cream whipped.

Method of making this and the next recipe is as follows: Mix the syrup
and yolks of eggs, strain into a warm bowl, add the raspberry and lemon
juice and maraschino, whisk till it creams well, then take the bowl out
of the hot water and whisk ten minutes longer; add the chocolate drops
and whipped cream; lightly fill a case or mold, and set in a freezer for
two hours, then cover the surface with lady-fingers (or sponge cake)
dried in the oven a pale brown, and rolled. Serve at once.

Another frozen _soufflé_ is as follows:

One pint of syrup, 32 degrees, half a pint of noyeau, half a pint of
cherry juice, two ounces of bruised macaroons, half a pint of thick
cream whipped, made in the same way as the last. I may here say that the
fruit juices can be procured now at all good druggists, so that these
_soufflés_ are very attainable in winter, and as noyeau and maraschino
do not form part of the stores in a family of small means, I will give
in this chapter recipes for the making of very fair imitations of the
genuine _liqueurs_.",recipe
