doc_id,text,genre
9624_drawnormadegravy.txt,"DRAWN OR MADE GRAVY.

For this purpose you may use coarse pieces of the lean of beef or veal,
or the giblets and trimmings of poultry or game. If must be stewed for
a long time, skimmed, strained, thickened, and flavoured with whatever
condiments are supposed most suited to the dish it is to accompany.

In preparing meat to stew for gravy, beat it with a mallet or
meat-beetle, score it, and cut it into small pieces; this makes it give
oat the juices. Season it with pepper and salt, and put it into a
stew-pan with butter only. Heat it gradually, till it becomes brown.
Shake the pan frequently, and see that it does not bum or stick to the
bottom. It will generally be browned sufficiently in half an hour. Then
put in some boiling water, allowing one pint to each pound of meat.
Simmer it on coals by the side of the fire for near three hours,
skimming it well, and keeping it closely covered. When done, remove it
from the heat, let it stand awhile to settle, and then strain it.

If you wish to keep it two or three days, (which you may in winter,)
put it into a stone vessel, cover it closely, and set it in a cool
place.

Do not thicken this gravy till you go to use it.",recipe
9624_driedbeans.txt,"DRIED BEANS.

Wash them and lay them in soak over night. Early in the morning put
them into a pot with plenty of water, and boil them slowly till dinner
time. They will require seven or eight hours to be sufficiently done.
Then take them off, put them into a sieve, and strain off the liquid.

Send the beans to table in a deep dish, seasoned with pepper, and
having a piece of butter mixed with them.",recipe
9624_driedorsmokedbeef.txt,"DRIED OR SMOKED BEEF.

The best part for this purpose is the round, which you must desire the
butcher to cut into four pieces. Wash the meat and dry it well in a
cloth. Grind or beat to powder an equal quantity of cloves and
allspice, and having mixed them together, rub them well into the beef
with your hand. The spice will be found a great improvement both to the
taste and smell of the meat. Have ready a pickle made precisely as that
in the preceding article. Boil and skim it, and (the meat having been
thoroughly rubbed all over with the spice) pour on the pickle, as
before directed. Keep the beef in the pickle at least six weeks, and
then smoke it about three weeks.

Smoked beef is brought on the tea-table either shaved into thin chips
without cooking, or chipped and fried with a little butter in a
skillet, and served up hot.

This receipt for dried or smoked beef will answer equally well for
venison ham, which is also used as a relish at the tea-table.

Mutton hams may be prepared in the same way.",recipe
9624_drippingpaste.txt,"DRIPPING PASTE.

To a pound of fresh beef-dripping, that has been nicely clarified,
allow two pounds and a quarter of flour. Put the flour into a large
pan, and mix the dripping with it, rubbing it into the flour with your
hands till it is thoroughly incorporated. Then make it into a stiff
dough with a little cold water, and roll it out twice. This may be used
for common meat pies.",recipe
9624_eastindiapickle.txt,"EAST INDIA PICKLE.

This is a mixture of various things pickled together, and put into the
same jar.

Have ready a small white cabbage, sliced, and the stalk removed; a
cauliflower cut into neat branches, leaving out the large stalk; sliced
cucumbers; sliced carrots; sliced beets, (all nicked round the edges;)
button-onions; string-beans; radish pods; barberries; cherries; green
grapes; nasturtians; capsicums; bell-peppers, &c. Sprinkle all these
things with salt, put them promiscuously into a large earthen pan, and
pour scalding salt and water over them. Let them lie in the brine for
four days, turning them all over every day. Then take them out, wash
each thing separately in vinegar, and wipe them carefully in a cloth.
Afterwards lay them on sieves before the fire and dry them thoroughly.

For the pickle liquor.—To every two quarts of the best vinegar, put an
ounce and a half of white ginger root, scraped and sliced; the same of
long pepper; two ounces of peeled shalots, or little button-onions, cut
in pieces; half an ounce of peeled garlic; an ounce of-turmeric; and
two ounces of mustard seed bruised, or of mustard powder. Let all these
ingredients, mixed with the vinegar, infuse in a close jar for a week,
setting in a warm place, or by the fire. Then (after the vegetables
have been properly prepared, and dried from the brine) put them all
into one large stone jar, or into smaller jars, and strain the pickle
over them. The liquid must be in a large quantity, so as to keep the
vegetables well covered with it, or they will spoil. Put a
table-spoonful of sweet oil on the top of each jar, and secure them
well with a large cork and a leather.

If you find that after awhile the vegetables have absorbed the liquor,
so that there is danger of their not having a sufficiency, prepare some
more seasoned vinegar and pour it over them.

East India pickle is very convenient, and will keep two years. As
different vegetables come into season, you can prepare them with the
salt and water process, and add them to the things already in the jar.
You may put small mangoes into this pickle; also plums, peaches and
apricots.",recipe
9624_eggnog.txt,"EGG NOGG.

Beat separately the yolks and whites of six eggs. Stir the yolks into a
quart of rich milk, or thin cream, and add half a pound of sugar. Then
mix in half a pint of rum or brandy. Flavour it with a grated nutmeg.
Lastly, stir in gently the beaten white of an egg.

It should be mixed in a china bowl.",recipe
9624_eggplumswhole.txt,"EGG PLUMS WHOLE.

Take large egg plums that are not quite ripe, and prick them all over
with a small silver fork. Leave on the stems. To three pounds of plums
allow three pounds and a half of loaf-sugar, broken small or powdered.
Put the plums and sugar into a preserving kettle, and pour in one half
pint of clear hard water. Hang the kettle over a moderate fire, and
boil and skim it, As soon as the skin begins to crack or shrivel, take
out the plums one at a time, (leaving the syrup on the fire,) and
spread them on large dishes to cool. Place them in the open air, and as
soon as they are cool enough to be touched with your fingers, smooth
the skin down where it is broken or ruffled, When quite cold, return
them to the syrup, (which in the mean time must have been kept slowly
simmering,) and boil the plums again till they are quite clear, but not
till they break. Put them warm into large glass or queen’s-ware jars,
and pour the syrup over them.",recipe
9624_eggsauce.txt,"EGG SAUCE.

Boil four eggs a quarter of an hour. Dip them into cold water to
prevent their looking blue. Peel off the shell. Chop the yolks of all,
and the whites of two, and stir them into melted butter. Serve this
sauce with boiled poultry or fish.",recipe
9624_elderberrywine.txt,"ELDERBERRY WINE.

Gather the elderberries when quite ripe; put them into a stone jar,
mash them with a round stick, and set them in a warm oven, or in a
large kettle of boiling water till the jar is hot through, and the
berries begin to simmer. Then take them out, and press and strain them
through a sieve. To every quart of juice allow a pound of Havanna or
Lisbon sugar, and two quarts of cold soft water. Put the sugar into a
large kettle, pour the juice over it, and, when it has dissolved, stir
in the water. Set the kettle over the fire, an& boil and skim it till
the scum ceases to rise. To four gallons of the liquor add a pint and a
half of brandy. Put it into a keg, and let it stand with the bung put
in loosely for four or five days, by which time it will have ceased to
ferment. Then stop it closely, plastering the bung with clay. At the
end of six months, draw off a little of it; and if it is not quite
clear and bright, refine it with the whites and shells of three or four
eggs, beaten to a stiff froth and stirred into a quart of the wine,
taken out for the purpose and then returned to the cask; or you may
refine it with an ounce or more of dissolved isinglass. Let it stand a
week or two, and then bottle it.

This is an excellent domestic wine, very common in England, and
deserving to be better known in America, where the elderberry tree is
found in great abundance. Elderberry wine is generally taken mulled
with spice, and warm.",recipe
9624_elderflowerwine.txt,"ELDER FLOWER WINE.

Take the flowers or blossoms of the elder tree, and strip them from the
stalks. To every quart of flowers allow one gallon of water, and three
pounds of while sugar. Boil and skim the sugar and water, and then pour
it hot on the flowers. When cool, mix in with it some lemon juice and
some yeast; allowing to six gallons of the liquor the juice of six
lemons, and four or five table-spoonfuls of good yeast stirred in very
hard. Let it ferment for three days in a tub covered with a double
blanket. Then strain the wine through a sieve, (add six whites of eggs
beaten to a stiff froth, or an ounce of melted isinglass,) and put it
into a cask, in the bottom of which you have laid four or five pounds
of the best raisins, stoned. Stop the cask closely, and in six months
the wine will be fit to bottle. It will much resemble Frontiniac, the
elder flowers imparting to it a very pleasant taste.",recipe
9624_electioncake.txt,"ELECTION CAKE.

Make a sponge (as it is called) in the following manner:—Sift into a
pan two pounds and a half of flour; and into a deep plate another
pound. Take a second pan, and stir a large table-spoonful of the best
West India molasses into five jills or two tumblers and a half of
strong fresh yeast; adding a Jill of water, warm, but not hot. Then
stir gradually into the yeast, &c. the pound of flour that you have
sifted separately. Cover it, and let it set by the fire three hours to
rise. While it is rising, prepare the other ingredients, by stirring in
a deep pan two pounds of fresh butter and two pounds of powdered sugar,
till they are quite light and creamy; adding to them a table-spoonful
of powdered cinnamon; a tea-spoonful of powdered mace; and two powdered
nutmegs. Stir in also half a pint of rich milk. Beat fourteen eggs till
very smooth and thick, and stir them gradually into the mixture,
alternately with the two pounds and a half of flour which you sifted
first. When the sponge is quite light, mix the whole together, and bake
it in buttered tin pans in a moderate oven. It should be eaten fresh,
as no sweet cake made with yeast is so good after the first day. If it
is not probable that the whole will come into use on the day it is
baked, mix but half the above quantity.",recipe
9624_essenceoflemonpeel.txt,"ESSENCE OF LEMON-PEEL.

Rub lumps of loaf-sugar on fine ripe lemons till the yellow rind is all
grated off; scraping up the sugar in a tea-spoon, and putting it on a
plate as you proceed. When you have enough, press it down into a little
glass or china jar, and cover it closely. This will be found very fine
to flavour puddings and cakes.

Prepare essence of orange-peel in the same manner.",recipe
9624_essenceofpeppermint_illness.txt,"ESSENCE OF PEPPERMINT.

Mix an ounce of oil of peppermint with a pint of alcohol. Then colour
it by putting in some leaves of green mint. Let it stand till the
colour is a fine green; then filter it through blotting paper. Drop it
on sugar when you take it.

Essence of pennyroyal, mint, cinnamon, cloves, &c. may all be prepared
in the same manner by mixing a portion of the essential oil with a
little alcohol.

You may obtain liquid camphor by breaking up and dissolving a lump in
white brandy or spirit of wine.",recipe
9624_evespudding.txt,"EVE’S PUDDING.

Pare, core, and quarter six large pippins, and chop them very fine.
Grate stale bread till you have six ounces of crumbs, and roll fine six
ounces of brown sugar. Pick, wash, and dry six ounces of currants, and
sprinkle them with flour. Mix all these ingredients together in a large
pan, adding six ounces of butter cut small, and two table-spoonfuls of
flour. Beat six eggs very light, and moisten the mixture with them. Add
a grated nutmeg, and a tea-spoonful of powdered cinnamon. Stir the
whole very well together. Have ready a pot of boiling water. Dip your
pudding cloth into it, shake it out, and dredge it with flour. Then put
in the mixture, and tie it very firmly; leaving space for the pudding
to swell, and stopping up the tying place with a paste of wetted flour.
Boil it three hours; keeping at the fire a kettle of boiling water, to
replenish the pot, that the pudding may be always well covered. Send it
to table hot, and eat it with sweetened cream flavoured with wine and
nutmeg.",recipe
9624_familysoup.txt,"FAMILY SOUP.

Take a shin or leg of beef that has been newly killed; the fore leg is
best, as there is the most meat on it. Have it cut into three pieces,
and wash it well. To each pound allow somewhat less than a quart of
water; for instance, to ten pounds of leg of beef, nine quarts of water
is a good proportion. Put it into a large pot, and add half a
table-spoonful of salt. Hang it over a good fire, as early as six
o’clock in the morning, if you dine at two. When it has come to a hard
boil, and the scum has risen, (which it will do as soon as it has
boiled,) skim it well. Do not remove the lid more frequently than is
absolutely necessary, as uncovering the pot causes the flavour to
evaporate. Then set it on hot coals in the corner, and keep it
simmering steadily, adding fresh coals so as to continue a regular
heat.

About nine o’clock, put in four carrots, one parsnip, and a large onion
cut into slices, and four small turnips, and eight tomatas, also cut
up; add a head of celery cut small. Put in a very small head of
cabbage, cut into little pieces. If you have any objection to cabbage,
substitute a larger proportion of the other vegetables. Put in also a
bunch of sweet marjoram, tied up in a thin muslin rag to prevent its
floating on the top.

Let the soup simmer unceasingly till two o’clock, skimming it well:
then take it up, and put it into a tureen. If your dinner hour is
later, you may of course begin the soup later; but it will require at
least eight hours’ cooking; remembering to put in the vegetables three
hours after the meat.

If you wish to send the meat to table, take the best part of it out of
the soup, about two hours before dinner. Have ready another pot with a
dozen tomatas and a few cloves. Moisten them with a little of the soup,
just sufficient to keep them from burning. When the tomatas have stewed
down soft, put the meat upon them, and let it brown till dinner time
over a few coals, keeping the pot closely covered; then send it to
table on a dish by itself. Let the remainder of the meat be left in the
large pot till you send up the soup, as by that time it will be boiled
to rags and have transferred all its flavour to the liquid.

This soup will be greatly improved by the addition of a few dozen
ochras cut into very thin slices, and put in with the other vegetables.
You may put Lima beans into it, green peas, or indeed any vegetables
you like: or you may thicken it with ochras and tomatas only.

Next day, take what is left of the soup, put it into a pot, and simmer
it over hot coals for half an hour: a longer time will weaken the
taste. If it has been well made and kept in a cool place, it will be
found better the second day than the first.

If your family is very small, and the leg of beef large, and the season
winter, it may furnish soup for four successive days. Cut the beef in
half; make soup of the first half, in the manner above directed, and
have the remainder warmed next day; then on the third day make fresh
soup of the second half.

We have been minute in these directions; for if strictly followed, the
soup, though plain, will be found excellent.

If you do not intend to serve up the meat separately, break to pieces
all the bones with a mallet or kitchen cleaver. This, by causing them
to give out their marrow, &c., will greatly enrich the liquid. Do this,
of course, when you first begin the soup.

FINE BEEF SOUP.

Begin this soup the day before it is wanted. Take a good piece of fresh
beef that has been newly killed: any substantial part will do that has
not too much fat about it: a fore leg is very good for this purpose.
Wash it well. Cut off all the meat, and break up the bones. Put the
meat and the bones into a large pot, very early in the day, so as to
allow eight or nine hours for its boiling. Proportion the water to the
quantity of meat—about a pint and a half to each pound. Sprinkle the
meat with a small quantity of pepper and salt. Pour on the water, hang
it over a moderate fire, and boil it slowly; carefully skimming off all
the fat that rises to the top, and keeping it closely covered, except
when you raise the lid to skim it. Do not, on any account, put in
additional water to this soup while it is boiling; and take care that
the boiling goes steadily on, as, if it stops, the soup will be much
injured. But if the fire is too great, and the soup boils too fast, the
meat will become hard and tough, and will not give out its juices.

After the meat is reduced to rags, and the soup sufficiently boiled,
remove the pot from the fire, and let it stand in the corner for a
quarter of an hour to settle. Then take it up, strain it into a large
earthen pan, cover it, and set it away in a cool dry place till next
day. Straining it makes it clear and bright, and frees it from the
shreds of meat and bone. If you find that it jellies in the pan, (which
it will if properly made,) do not disturb it till you are ready to put
it into the pot for the second boiling, as breaking the jelly may
prevent it from keeping well.

On the following morning, boil separately, carrots, turnips, onions,
celery, and whatever other vegetables you intend to thicken the soup
with. Tomatas will greatly improve it. Prepare them by taking off the
skin, cutting them into small pieces, and stewing them in their own
juice till they are entirely dissolved. Put on the carrots before any
of the other vegetables, as they require the longest time to boil. Or
you may slice and put into the soup a portion of the vegetables you are
boiling for dinner; but they must be nearly done before you put them
in, as the second boiling of the soup should not exceed half an hour,
or indeed, just sufficient time to heat it thoroughly.

Scrape off carefully from the cake of jellied soup whatever fat or
sediment may still be remaining on it; divide the jelly into pieces,
and about half an hour before it is to go to table, put it into a pot,
add the various vegetables, (having first sliced them,) in sufficient
quantities to make the soup very thick; hang it over the fire and let
it boil slowly, or simmer steadily till dinner time. Boiling it much on
the second day will destroy the flavour, and render it flat and
insipid. For this reason, in making fine, clear beef soup, the
vegetables are to be cooked separately. They need not be put in the
first day, as the soup is to be strained; and on the second day, if put
in raw, the length of time required to cook them would spoil the soup
by doing it too much. We repeat, that when soup has been sufficiently
boiled on the first day, and all the juices and flavour of the meat
thoroughly extracted, half an hour is the utmost it requires on the
second.

Carefully avoid seasoning it too highly. Soup, otherwise excellent, is
frequently spoiled by too much pepper and salt. These condiments can be
added at table, according to the taste of those that are eating it; but
if too large a proportion of them is put in by the cook, there is then
no remedy, and the soup may by some be found uneatable.

Many persons prefer boiling all the vegetables in the soup on the first
day, thinking that they improve its flavour. This may be done in common
soup that is not to be strained, but is inadmissible if you wish it to
be very bright and clear. Also, unless you have a garden and a
profusion of vegetables of your own, it is somewhat extravagant, as
when strained out they are of no further use, and are therefore wasted.",recipe
9624_federalcakes.txt,"FEDERAL CAKES.

Sift two pounds of flour into a deep pan, and cut up in it a pound of
fresh butter; rub the butter into the flour with your hands, adding by
degrees, half a pound of powdered white sugar; a tea-spoonful of
powdered cinnamon; a beaten nutmeg; a glass of wine or brandy, and two
glasses of rose water. Beat four eggs very light; and add them to the
mixture with a salt-spoonful of pearl-ash melted in a little lukewarm
water. Mix all well together; add, if necessary, sufficient cold water
to make it into a dough just stiff enough to roll out; knead it
slightly, and then roll it out into a sheet about half an inch thick.
Cut it out into small cakes with a tin cutter, or with the edge of a
tumbler; dipping the cutter frequently into flour, to prevent its
sticking. Lay the cakes in shallow pans buttered, or on flat sheets of
tin, (taking care not to let them touch, lest they should run into each
other,) and bake them of a light brown in a brisk oven. They are best
the second day.",recipe
9624_finemilkpunch.txt,"FINE MILK PUNCH.

Pare off the yellow rind of nine large lemons, and steep it for
twenty-four hours in a quart of brandy or rum. Then mix with it the
juice of the lemons, a pound and a half of loaf-sugar, two grated
nutmegs, and a quart of water. Add a quart of rich unskimmed milk, made
boiling hot, and strain the whole through a jelly-bag. You may either
use it as soon as it is cold, or make a larger quantity, (in the above
proportions,) and bottle it. It will keep several months.",recipe
9624_finepuffpaste.txt,"FINE PUFF PASTE.

To every pound of the best fresh butter allow a pound or a quart of
superfine flour. Sift the flour into a deep pan, and then sift on a
plate some additional flour to use for sprinkling and rolling. Wash the
butter through two cold waters; squeezing out all the salt, and
whatever milk may remain in it; and then make it up with your hands
into a round lump, and put it in ice till you are ready to use it. Then
divide the butter into four equal parts. Cut up one of the quarters
into the pan of flour; and divide the remaining three quarters into six
pieces, [Footnote: Or into nine; and roll it in that number of times.]
cutting each quarter in half. Mix with a knife the flour and butter
that is in the pan, adding by degrees a very little cold water till you
have made it into a lump of stiff dough. Then sprinkle some flour on
the paste-board, (you should have a marble slab,) take the dough from
the pan by lifting it out with the knife, lay it on the board, and
flouring your rolling-pin, roll out the paste into a large thin sheet.
Then with the knife, put all over it, at equal distances, one of the
six pieces of butter divided into small bits. Fold up the sheet of
paste, flour it, roll it out again, and add in the same manner another
of the portions of butter. Repeat this process till the butter is all
in. Then fold it once more, lay it on a plate, and set it in a cool
place till you are ready to use it. Then divide it into as many pieces
as you want sheets of paste; roll out each sheet, and put them into
buttered plates or patty-pans. In using the rolling-pin, observe always
to roll from you. Bake the paste in a moderate oven, but rather quick
than slow. No air must be admitted to it while baking.

The edges of paste should always be notched before it goes into the
oven. For this purpose, use a sharp penknife, dipping it frequently in
flour as it becomes sticky. The notches should be even and regular. If
you do them imperfectly at first, they cannot be mended by sticking on
additional bits of paste; as, when baked, every patch will be doubly
conspicuous. There are various ways of notching; one of the neatest is
to fold over one corner of each notch; or you may arrange the notches
to stand upright and lie flat, alternately, all round the edge. They
should be made small and regular. You may form the edge into leaves
with the little tin cutters made for the purpose.

If the above directions for puff paste are carefully followed, and if
it is not spoiled in baking, it will rise to a great thickness and
appear in flakes or leaves according to the number of times you have
put in the butter.

It should be eaten the day it is baked.",recipe
9624_finesausages.txt,"FINE SAUSAGES.

Take some fresh pork, (the leg is best,) and clear it from the skin,
sinews, and gristle. Allow two pounds of fat to three pounds of lean.
Mince it all very fine, and season it with two ounces and a half of
salt, half an ounce of pepper, thirty cloves, and a dozen blades of
mace powdered, three grated, nutmegs, six table-spoonfuls of powdered
sage, and two tea-spoonfuls of powdered rosemary. Mix all well
together. Put it into a stone jar, and press it down very hard. Cover
it closely, and keep it in a dry cool place.

When you use this sausage-meat, mix with it some beaten yolk of egg,
and make it into balls or cakes. Dredge them with flour, and fry them
in butter.",recipe
9624_finesuetdumplings.txt,"FINE SUET DUMPLINGS.

Grate the crumb of a stale six cent loaf, and mix it with nearly as
much beef suet, chopped as fine as possible. Add a grated nutmeg, and
two large table-spoonfuls of sugar. Beat four eggs with four
table-spoonfuls of white wine or brandy. Mix all well together to a
stiff paste. Flour your hands, and make up the mixture into balls or
dumplings about the size of turkey eggs. Have ready a pot of boiling
water. Put the dumplings into cloths, and let them boil about half an
hour. Serve them hot, and eat them with wine sauce.",recipe
